{
  "schemaVersion": "2.5",
  "appVersion": "2.5.0",
  "generatedAt": "2026-08-22T16:20:00-04:00",
  "searchName": "Fluxology GTA private office scout",
  "hardAllInCeilingCad": 850,
  "listings": [
    {
      "id": "venturex-sherwoodtowne-4230",
      "operator": "Venture X Sherwoodtowne",
      "address": "4230 Sherwoodtowne Blvd",
      "municipality": "Mississauga",
      "askingRent": 650,
      "estimatedAllInMonthly": 734.5,
      "costStatus": "plausible",
      "mandatoryFeesKnown": false,
      "hstStatus": "13% HST produces $734.50 before any undisclosed mandatory fee",
      "tmiStatus": "Not separately disclosed",
      "utilitiesStatus": "Appears bundled; exact private-office package needs verification",
      "internetStatus": "High-speed secured internet offered; inclusion in $650 rate not explicitly verified",
      "cleaningStatus": "Listed centre amenity; package inclusion needs final verification",
      "mandatoryFeeNotes": "Unknown whether any mandatory membership/service fee applies",
      "size": "1-person private office; exact sq. ft. not disclosed",
      "leaseType": "Serviced private office",
      "lockableDoor": true,
      "access24h": true,
      "furnished": true,
      "mailRights": true,
      "directoryRights": null,
      "signageRights": "Unknown",
      "shortCommitment": true,
      "term": "Flexible / month-to-month offered",
      "amenities": [
        "meeting/common areas",
        "concierge",
        "complimentary parking"
      ],
      "parking": "Complimentary",
      "transitConnection": "MiWay · Rathburn Rd / Sherwoodtowne Blvd",
      "finalWalkMinutes": 4,
      "skateboardPractical": true,
      "skateboardNote": "Short ordinary urban sidewalk segment; highly practical",
      "summary": "Strong Mississauga lead with 24/7 access, mail rights and a lockable furnished office; recurring-fee verification still required.",
      "notes": "Recategorized out of Deliverable A: Venture X is a managed-office network already tracked under managed-providers.json (id venture-x-canada), so it cannot also stand as a non-managed listing here without violating the never-merge rule. Live re-check this run (LiquidSpace) confirms the location is still open and now signals a 1-person private office from ~C$600/month (down from C$650), 1-month minimum term, 24/7 access, lockable door, furnished, mail extra fee — folded into the provider profile.",
      "sourceUrl": "https://liquidspace.com/ca/on/mississauga/venture-x-sherwoodtowne/private-office",
      "lastVerified": "2026-08-22",
      "lastChanged": "2026-08-22",
      "active": false,
      "priceHistory": [
        {
          "date": "2026-08-08",
          "askingRent": 650,
          "estimatedAllInMonthly": 734.5
        },
        {
          "date": "2026-08-22",
          "askingRent": 600,
          "estimatedAllInMonthly": 678.0
        }
      ]
    },
    {
      "id": "village-hive-duncan-mill",
      "operator": "The Village Hive",
      "address": "150 Duncan Mill Rd",
      "municipality": "Toronto",
      "askingRent": 950,
      "estimatedAllInMonthly": 1073.5,
      "costStatus": "over",
      "mandatoryFeesKnown": false,
      "hstStatus": "13% HST produces $734.50 before any undisclosed mandatory fee",
      "tmiStatus": "No separate TMI identified in membership pricing",
      "utilitiesStatus": "Shared-office membership model; no separate utility charge identified",
      "internetStatus": "Wi-Fi listed as amenity",
      "cleaningStatus": "Shared-space service; exact room cleaning inclusion not explicitly verified",
      "mandatoryFeeNotes": "Published price is 'from $650'; exact currently available room and any required extra fee must be confirmed",
      "size": "Private furnished office; exact available room size unknown",
      "leaseType": "Private office membership",
      "lockableDoor": true,
      "access24h": true,
      "furnished": true,
      "mailRights": true,
      "directoryRights": null,
      "signageRights": "Unknown",
      "shortCommitment": true,
      "term": "Month-to-month or annual",
      "amenities": [
        "meeting-room hours",
        "Wi-Fi",
        "printers",
        "kitchen",
        "free parking"
      ],
      "parking": "Free",
      "transitConnection": "TTC bus service via Don Mills / York Mills area",
      "finalWalkMinutes": null,
      "skateboardPractical": true,
      "skateboardNote": "Suburban office-park sidewalks; final distance should be route-checked from the selected TTC stop",
      "summary": "Very attractive $650-class option with 24/7 access and business mailing address included.",
      "notes": "Retired: (1) The Village Hive is a managed-office network already tracked under managed-providers.json (id village-hive) and should not also be a non-managed listing. (2) Live re-check this run (members.duncanmillhive.ca / current aggregator listings) shows Duncan Mill private offices now start at C$950/month, well above the prior C$650 record and above the $850 non-managed ceiling; the North York location is also flagged [INACTIVE] on one aggregator. Folded current pricing into the provider profile.",
      "sourceUrl": "https://duncanmillhive.ca/coworking-spaces-north-york/",
      "lastVerified": "2026-08-22",
      "lastChanged": "2026-08-22",
      "active": false,
      "priceHistory": [
        {
          "date": "2026-08-07",
          "askingRent": 650,
          "estimatedAllInMonthly": 734.5
        },
        {
          "date": "2026-08-22",
          "askingRent": 950,
          "estimatedAllInMonthly": 1073.5
        }
      ]
    },
    {
      "id": "humbold-1120-finch",
      "operator": "Humbold Business Centre (listed via Office Hub)",
      "address": "1120 Finch Ave W",
      "municipality": "Toronto",
      "askingRent": 650,
      "estimatedAllInMonthly": 734.5,
      "costStatus": "plausible",
      "mandatoryFeesKnown": false,
      "hstStatus": "13% HST produces $734.50 before any undisclosed mandatory fee; HST treatment not stated on the listing",
      "tmiStatus": "Unknown",
      "utilitiesStatus": "Not itemized separately; office is advertised fully furnished",
      "internetStatus": "Not explicitly itemized in this listing",
      "cleaningStatus": "Office cleaning listed as an included service",
      "mandatoryFeeNotes": "humbold.ca no longer resolves (DNS failure) — the operator's own domain appears dead. The building and inventory are still live via an Office Hub aggregator listing verified this run. This is now a 2-person-capacity private office (1-2 desks); no 1-person-only SKU is currently listed, so per-person economics are weaker than a dedicated 1-person office.",
      "size": "2-person private office (1-2 desks); exact sq ft not disclosed",
      "leaseType": "Private office / office-centre inventory",
      "lockableDoor": true,
      "access24h": true,
      "furnished": true,
      "mailRights": true,
      "directoryRights": null,
      "signageRights": "Unknown",
      "shortCommitment": null,
      "term": "Unknown",
      "amenities": [
        "free parking",
        "24/7 access",
        "meeting rooms",
        "office cleaning",
        "shared kitchen",
        "reception",
        "mail handling",
        "printing"
      ],
      "parking": "Free",
      "transitConnection": "TTC · Finch West Station / local bus",
      "finalWalkMinutes": 19,
      "skateboardPractical": true,
      "skateboardNote": "Within stated tolerance; straightforward urban/suburban sidewalk route",
      "summary": "Interesting conventional-office lead with excellent budget headroom, but too many recurring costs remain unverified.",
      "notes": "Original humbold.ca source is dead (DNS failure); re-sourced via a live Office Hub aggregator listing for the same building this run. CLARIFICATION REQUIRED: confirm whether a genuine 1-person office is available (this SKU is 1-2 desks), exact sq ft, lockable-door status, and whether HST/internet are already included in the $650 figure.",
      "sourceUrl": "https://www.office-hub.com/ca/listings/2-person-private-office-1120-finch-avenue-west-toronto-ontario-m3j3h7-a0tQg00000KMjHVIA1",
      "lastVerified": "2026-08-22",
      "lastChanged": "2026-08-22",
      "active": true,
      "priceHistory": [
        {
          "date": "2026-08-07",
          "askingRent": 652,
          "estimatedAllInMonthly": 736.76
        },
        {
          "date": "2026-08-22",
          "askingRent": 650,
          "estimatedAllInMonthly": 734.5
        }
      ]
    },
    {
      "id": "gtec-2985-drew",
      "operator": "Greater Toronto Executive Centre",
      "address": "2985 Drew Rd",
      "municipality": "Mississauga",
      "askingRent": 797,
      "estimatedAllInMonthly": 900.61,
      "costStatus": "over",
      "mandatoryFeesKnown": true,
      "hstStatus": "$797 + 13% HST = approximately $900.61",
      "tmiStatus": "Serviced-office package; no separate TMI assumption required for this calculation",
      "utilitiesStatus": "Reported included in some centre inventory",
      "internetStatus": "Available; exact package can vary",
      "cleaningStatus": "Reported included in some centre inventory",
      "mandatoryFeeNotes": "Current one-person inventory observed at $797 before tax, already above the hard ceiling after HST",
      "size": "1-person private office",
      "leaseType": "Serviced private office",
      "lockableDoor": true,
      "access24h": true,
      "furnished": true,
      "mailRights": true,
      "directoryRights": null,
      "signageRights": "Unknown",
      "shortCommitment": true,
      "term": "Flexible serviced-office terms",
      "amenities": [
        "reception",
        "shared kitchen/lounge",
        "meeting rooms",
        "complimentary parking"
      ],
      "parking": "Complimentary",
      "transitConnection": "MiWay · Airport Rd / Slough St; Malton GO nearby",
      "finalWalkMinutes": 3,